indiano,índio,-a		[sound:3001-4000-cambridge-indian.mp3]	belonging to or relating to India or its people
para frente	/<span class="ipa dipa">fɔrθ</span>/	[sound:3001-4000-cambridge-forth.mp3]	in a forward direction: used mainly in the phrase ‘back and forth’
			
motor	/<span class="ipa dipa">ˈen·dʒɪn</span>/	[sound:3001-4000-cambridge-eus75693.mp3]	the part of a vehicle that uses oil, electricity, or steam to make it move
			
vaiar,vaia		[sound:3001-4000-cambridge-boo.mp3]	to make an expression of strong disapproval or disagreement
			
			
			
pôquer	/<span class="ipa dipa">ˈpoʊ·kər</span>/	[sound:3001-4000-cambridge-eus73624.mp3]	a game played with cards in which people try to win money from each other
dezoito	/<span class="ipa dipa">ˌeɪˈtin</span>/	[sound:3001-4000-cambridge-eighteen.mp3]	the number 18
			
bolacha,biscoito	/<span class="ipa dipa">ˈkʊk·i</span>/	[sound:3001-4000-cambridge-cookie.mp3]	a thin, flat cake that is sweet and dry
enterrar,sepultar	/<span class="ipa dipa">ˈber·i</span>/	[sound:3001-4000-cambridge-berry.mp3]	to put a dead body into the ground
apresentar,executar,fazer,realizar,cumprir,desempenhar,funcionar	/<span class="ipa dipa">pərˈfɔrm</span>/	[sound:3001-4000-cambridge-eus73497.mp3]	to act, sing, dance, or play music for other people to enjoy
			
cotidiano	/<span class="ipa dipa">ˈev·riˌdeɪ</span>/	[sound:3001-4000-cambridge-everyday.mp3]	normal, usual, or happening every day
			
			
repugnante,horripilante	/<span class="ipa dipa">ˈkri·pi</span>/	[sound:3001-4000-cambridge-creepy.mp3]	strange and frightening
			
			
rastro,trilha	/<span class="ipa dipa">treɪl</span>/	[sound:3001-4000-cambridge-trail.mp3]	a line of marks that someone or something leaves behind as they move
santo	/<span class="ipa dipa">seɪnt</span>/	[sound:3001-4000-cambridge-saint.mp3]	a dead person who lived their life in a holy way
podre,estragado,péssimo	/<span class="ipa dipa">ˈrɑ·t<span class="sp dsp">ə</span>n</span>/	[sound:3001-4000-cambridge-rotten.mp3]	old and bad
fígado	/<span class="ipa dipa">ˈlɪv·ər</span>/	[sound:3001-4000-cambridge-liver.mp3]	a part in your body that cleans your blood
			
particípio passado de “draw”	/<span class="ipa dipa">drɔn</span>/	[sound:3001-4000-cambridge-drawn.mp3]	past participle of draw
aparelho,dispositivo	/<span class="ipa dipa">dɪˈvɑɪs</span>/	[sound:3001-4000-cambridge-eus71257.mp3]	a piece of equipment
prostituta,puta	/<span class="ipa dipa">hɔːr</span>/	[sound:3001-4000-cambridge-whore.mp3]	a female prostitute
obrigado		[sound:3001-4000-cambridge-cus02015.mp3]	thank you
mágico,encantado	/<span class="ipa dipa">ˈmædʒ·ɪ·kəl</span>/	[sound:3001-4000-cambridge-magical.mp3]	with special powers
			
povoado,vila,lugarejo,aldeia	/<span class="ipa dipa">ˈvɪl·ɪdʒ</span>/	[sound:3001-4000-cambridge-village.mp3]	a place where people live in the countryside that is smaller than a town
marcha,passeata,marchar,fazer uma passeata	/<span class="ipa dipa">mɑrtʃ</span>/	[sound:3001-4000-cambridge-march.mp3]	an organized event where people walk in a group to show that they agree or disagree with something strongly
viagem,viajar	/<span class="ipa dipa">ˈdʒɜr·ni</span>/	[sound:3001-4000-cambridge-journey.mp3]	a trip from one place to another
			
			
zumbi	/<span class="ipa dipa">ˈzɑːm-</span>/	[sound:3001-4000-cambridge-zombie.mp3]	a person who has no energy, seems to act without thinking, and does not notice what is happening
abastecer,suprir,fornecer,suprimento,provisão	/<span class="ipa dipa">səˈplɑɪ</span>/	[sound:3001-4000-cambridge-supply.mp3]	to give things that people want or need, often over a long period of time
moral,moralmente	/<span class="ipa dipa">ˈmɔr·əl</span>, <span class="ipa dipa">ˈmɑr·əl</span>/	[sound:3001-4000-cambridge-moral.mp3]	relating to beliefs about what behaviour is good and what behaviour is bad
útil,prestativo	/<span class="ipa dipa">ˈhelp·fəl</span>/	[sound:3001-4000-cambridge-helpful.mp3]	useful
ser apagado a alguém,algo	/<span class="ipa dipa">əˈtætʃt</span>/	[sound:3001-4000-cambridge-attached.mp3]	to like someone or something very much
			
			
penetrante	/<span class="ipa dipa">ˈsɝː-</span>/	[sound:3001-4000-cambridge-searching.mp3]	intended to find out the often hidden truth about something
passado de “fly”	/<span class="ipa dipa">flu</span>/	[sound:3001-4000-cambridge-flew.mp3]	past tense of fly
deprimido	/<span class="ipa dipa">dɪˈprest</span>/	[sound:3001-4000-cambridge-depressed.mp3]	very sad, often for a long time
			
corredor	/<span class="ipa dipa">ɑɪl</span>/	[sound:3001-4000-cambridge-aisle.mp3]	a passage between the lines of seats in a plane, church, theatre, etc.
subterrâneo,embaixo da terra,metrô	/<span class="ipa dipa">ˌʌn·dərˈɡrɑʊnd</span>/,/<span class="ipa dipa">ˈʌn·dərˌɡrɑʊnd</span>/	[sound:3001-4000-cambridge-eus74713.mp3],[sound:3001-4000-cambridge-underground.mp3]	under the surface of the ground
os prós e contras	/<span class="ipa dipa">proʊ</span>/	[sound:3001-4000-cambridge-pro.mp3]	the advantages and disadvantages of something
passado de “draw”	/<span class="ipa dipa">dru</span>/	[sound:3001-4000-cambridge-drew.mp3]	past tense of draw
			
			
amém		[sound:3001-4000-cambridge-amen.mp3]	said or sung at the end of a prayer or a religious song to express agreement with what has been said
			
proposta,pedido de casamento	/<span class="ipa dipa">prəˈpoʊ·zəl</span>/	[sound:3001-4000-cambridge-proposal.mp3]	a suggestion for a plan
fossa,buraco,caroço,poço de mina	/<span class="ipa dipa">pɪt</span>/	[sound:3001-4000-cambridge-pit.mp3]	a large hole that has been dug in the ground
			
remendar,droga!,maldito,desgraçado	/<span class="ipa dipa">dɑːrn</span>/	[sound:3001-4000-cambridge-darn.mp3]	to repair a hole or a piece of clothing with long stitches across the hole and other stitches across them
argila,barro	/<span class="ipa dipa">kleɪ</span>/	[sound:3001-4000-cambridge-clay.mp3]	a heavy soil that is hard when it is dry, used for making bricks and containers
			
arranjar,combinar,arrumar,dispor	/<span class="ipa dipa">əˈreɪndʒ</span>/	[sound:3001-4000-cambridge-arrange.mp3]	to make plans for something to happen
			
			
inútil,que não se presta	/<span class="ipa dipa">ˈjus·ləs</span>/	[sound:3001-4000-cambridge-useless.mp3]	If something is useless, it does not work well or it has no effect.
esquadrão,elenco	/<span class="ipa dipa">skwɑd</span>/	[sound:3001-4000-cambridge-squad.mp3]	a group of people who have special skills to deal with particular problems
representar	/<span class="ipa dipa">ˌrep·rɪˈzent</span>/	[sound:3001-4000-cambridge-represent.mp3]	to officially speak for someone else because they have asked you to
produto	/<span class="ipa dipa">ˈprɑ·dəkt</span>/	[sound:3001-4000-cambridge-product.mp3]	something that someone makes or grows so that they can sell it
			
depois,após,mais tarde,posteriormente	/<span class="ipa dipa">ˈæf.tɚ.wɚdz</span>/	[sound:3001-4000-cambridge-afterwards_afterward.mp3]	at a later time, after something else has happened
aventura	/<span class="ipa dipa">ədˈven·tʃər</span>/	[sound:3001-4000-cambridge-eus70096.mp3]	an exciting and sometimes dangerous experience
resistir a,recusar,opor-se,opor-se a	/<span class="ipa dipa">rɪˈzɪst</span>/	[sound:3001-4000-cambridge-resist.mp3]	to stop yourself from doing something that you want to do
protegido	/<span class="ipa dipa">prəˈtek·tɪd</span>/	[sound:3001-4000-cambridge-protected.mp3]	protected animals, plants, and land are kept safe by laws that stop people from harming or damaging them
forma abreviada de “the internet”,rede,líquido	/<span class="ipa dipa">net</span>/	[sound:3001-4000-cambridge-net.mp3]	short form of the internet
			
quatorze	/<span class="ipa dipa">ˌfɔrˈtin</span>/	[sound:3001-4000-cambridge-fourteen.mp3]	the number 14
			
			
piano	/<span class="ipa dipa">piˈæn·oʊ</span>/	[sound:3001-4000-cambridge-eus73547.mp3]	a big musical instrument with black and white keys that make sounds when you press them
polegada	/<span class="ipa dipa">ɪntʃ</span>/	[sound:3001-4000-cambridge-inch.mp3]	a unit for measuring length, equal to 2.54 centimetres
bandeira	/<span class="ipa dipa">flæɡ</span>/	[sound:3001-4000-cambridge-flag.mp3]	a piece of cloth with a special design and colours that is the symbol of a country or group
dívida	/<span class="ipa dipa">det</span>/	[sound:3001-4000-cambridge-debt.mp3]	an amount of money that you owe someone
escuridão	/<span class="ipa dipa">ˈdɑrk·nəs</span>/	[sound:3001-4000-cambridge-darkness.mp3]	a state in which there is little or no light
violento,violentamente	/<span class="ipa dipa">ˈvɑɪ·ə·lənt</span>/	[sound:3001-4000-cambridge-violent.mp3]	involving or showing violence
etiqueta	/<span class="ipa dipa">tæɡ</span>/	[sound:3001-4000-cambridge-tag.mp3]	a small piece of paper or plastic with information on it that is fixed to something
areia	/<span class="ipa dipa">sænd</span>/	[sound:3001-4000-cambridge-sand.mp3]	a substance found on beaches, made up of very small grains of rock
gengiva,chiclete,goma de mascar	/<span class="ipa dipa">ɡʌm</span>/	[sound:3001-4000-cambridge-gum.mp3]	the hard, pink part inside your mouth that your teeth grow out of
			
			
despir,desnudar,descobrir,tira,faixa	/<span class="ipa dipa">strɪp</span>/	[sound:3001-4000-cambridge-strip.mp3]	to remove all your clothes, or to remove all someone else’s clothes
			
quadril	/<span class="ipa dipa">hɪp</span>/	[sound:3001-4000-cambridge-hip.mp3]	one of the two parts of your body above your leg and below your waist
comemoração	/<span class="ipa dipa">ˌsel·əˈbreɪ·ʃən</span>/	[sound:3001-4000-cambridge-celebration.mp3]	an occasion or party that celebrates a special event
debaixo (de),abaixo (de)	/<span class="ipa dipa">bɪˈloʊ</span>/	[sound:3001-4000-cambridge-below.mp3]	in a lower position than someone or something else
			
palácio	/<span class="ipa dipa">ˈpæl·əs</span>/	[sound:3001-4000-cambridge-palace.mp3]	a large house where a king or queen lives
			
			
repor,substituir	/<span class="ipa dipa">rɪˈpleɪs</span>/	[sound:3001-4000-cambridge-replace.mp3]	to get something new because the one you had before has been lost or damaged
			
papelada	/<span class="ipa dipa">-pɚ.wɝːk</span>/	[sound:3001-4000-cambridge-uspaneg021.mp3]	the part of a job that involves writing letters and reports and keeping records
forte,poderoso	/<span class="ipa dipa">ˈmɑɪ·t̬i</span>/	[sound:3001-4000-cambridge-eus73004.mp3]	very powerful or successful
			
			
			
típico	/<span class="ipa dipa">ˈtɪp·ɪ·kəl</span>/	[sound:3001-4000-cambridge-typical.mp3]	having all the qualities you expect a particular person, object, place, etc. to have
teimoso,obstinado,teimosamente,teimosia	/<span class="ipa dipa">ˈstʌb·ərn</span>/	[sound:3001-4000-cambridge-stubborn.mp3]	never changing your ideas, plans, etc. even when you should
estável,fixo,cocheira	/<span class="ipa dipa">ˈsteɪ·bəl</span>/	[sound:3001-4000-cambridge-stable.mp3]	not likely to change or end suddenly
			
libra,unidade de peso equivalente a 453.6 g ou 16 onças	/<span class="ipa dipa">paʊnd</span>/	[sound:3001-4000-cambridge-pound.mp3]	the unit of money used in the UK
travesseiro,almofada	/<span class="ipa dipa">ˈpɪl·oʊ</span>/	[sound:3001-4000-cambridge-pillow.mp3]	a soft object that you put your head on in bed
papai,pai	/<span class="ipa dipa">ˈpɑ·pə</span>/	[sound:3001-4000-cambridge-papa.mp3]	father
maduro,amadurecer	/<span class="ipa dipa">məˈtʃʊər</span>/	[sound:3001-4000-cambridge-mature.mp3]	completely grown or developed
colo,volta	/<span class="ipa dipa">læp</span>/	[sound:3001-4000-cambridge-lap.mp3]	the top part of your legs when you are sitting down
			
atual,corrente,atualmente	/<span class="ipa dipa">ˈkɜr·ənt</span>, <span class="ipa dipa">ˈkʌr·ənt</span>/	[sound:3001-4000-cambridge-currant.mp3]	happening or existing now
			
bunda,mendigo,-a		[sound:3001-4000-cambridge-bum.mp3]	the part of the body that you sit on
tensão	/<span class="ipa dipa">ˈten·ʃən</span>/	[sound:3001-4000-cambridge-tension.mp3]	a feeling of fear or anger between people or countries who do not trust each other
tanque	/<span class="ipa dipa">tæŋk</span>/	[sound:3001-4000-cambridge-tank.mp3]	a large container for keeping liquid or gas
			
passar a mão em,acariciar,AVC,derrame,traço,braçada,um golpe de sorte	/<span class="ipa dipa">stroʊk</span>/	[sound:3001-4000-cambridge-stroke.mp3]	to gently move your hand over a surface
constante,regular,firme,seguro,constantemente,regularmente,seguramente,estabilizar	/<span class="ipa dipa">ˈsted·i</span>/	[sound:3001-4000-cambridge-steady.mp3]	happening at a gradual, regular rate
suprir,fornecer	/<span class="ipa dipa">prəˈvɑɪd</span>/	[sound:3001-4000-cambridge-provide.mp3]	to give something to someone
durante a noite,da noite para o dia	/<span class="ipa dipa">ˌoʊ·vərˈnɑɪt</span>/	[sound:3001-4000-cambridge-eus75422.mp3]	during the night
enquanto isso	/<span class="ipa dipa">ˈminˌhwɑɪl</span>/	[sound:3001-4000-cambridge-meanwhile.mp3]	in the time between two things happening, or while something else is happening
			
carne de vaca/boi	/<span class="ipa dipa">bif</span>/	[sound:3001-4000-cambridge-beef.mp3]	the meat of a cow
			
			
canção de Natal	/<span class="ipa dipa">ˈkær·əl</span>/	[sound:3001-4000-cambridge-carol.mp3]	a song that people sing at Christmas
			
sal,salgar	/<span class="ipa dipa">sɔlt</span>/	[sound:3001-4000-cambridge-salt.mp3]	a white substance used to add flavour to food
			
			
expressar,exprimir,manifestar	/<span class="ipa dipa">ɪkˈspres</span>/	[sound:3001-4000-cambridge-express.mp3]	to show what you think or how you feel using words or actions
colecionar,coletar,recolher,acumular-se,apanhar,pagável pelo recebedor,a cobrar	/<span class="ipa dipa">kəˈlekt</span>/	[sound:3001-4000-cambridge-collect.mp3]	to get and keep things of one type, such as stamps or coins, as a hobby
			
forma abreviada de “Bachelor of Arts”: Bacharelado em Ciências Humanas		[sound:3001-4000-cambridge-usavowa021.mp3]	abbreviation for Bachelor of Arts: a first university degree (= qualification) in the arts or social sciences, or someone who has this degree
tragédia	/<span class="ipa dipa">ˈtrædʒ·ɪ·di</span>/	[sound:3001-4000-cambridge-tragedy.mp3]	something very sad that happens, usually involving death
portanto	/<span class="ipa dipa">ˈðeərˌfɔr</span>/	[sound:3001-4000-cambridge-therefore.mp3]	for that reason
estragar,mimar	/<span class="ipa dipa">spɔɪl</span>/	[sound:3001-4000-cambridge-spoil.mp3]	to stop something from being enjoyable or successful
			
reino		[sound:3001-4000-cambridge-realm.mp3]	a country ruled by a king or queen
perfil	/<span class="ipa dipa">ˈproʊ·fɑɪl</span>/	[sound:3001-4000-cambridge-profile.mp3]	a short description of a person, organization, etc., giving the main details about them
			
enxugar,limpada,enxugada,lenço	/<span class="ipa dipa">wɑɪp</span>/	[sound:3001-4000-cambridge-wipe.mp3]	to clean or dry something by moving a cloth across it
			
cirurgião,-ã	/<span class="ipa dipa">ˈsɜr·dʒən</span>/	[sound:3001-4000-cambridge-surgeon.mp3]	a doctor who cuts people’s bodies and removes or repairs part of them
esticar,estirar,espichar,estender,estender-se,trecho,intervalo,período,de uma vez,alongamento,distensão	/<span class="ipa dipa">stretʃ</span>/	[sound:3001-4000-cambridge-stretch.mp3]	to become longer or wider, or to pull something so that it becomes longer or wider
			
sobrinho	/<span class="ipa dipa">ˈnef·ju</span>/	[sound:3001-4000-cambridge-nephew.mp3]	the son of your brother or sister
arrumado,ordenado,legal	/<span class="ipa dipa">nit</span>/	[sound:3001-4000-cambridge-neat.mp3]	well arranged and clean
			
raposa,desconcertar,deixar perplexo	/<span class="ipa dipa">fɑks</span>/	[sound:3001-4000-cambridge-fox.mp3]	a wild animal like a dog with brown fur and a long, thick tail
seguro,confiante,seguramente,confiantemente	/<span class="ipa dipa">ˈkɑn·fɪ·dənt</span>/	[sound:3001-4000-cambridge-confident.mp3]	certain about your ability to do things well
anti-,contra	/<span class="ipa dipa">ˌæn·t̬i</span>, <span class="ipa dipa">ˌæn·tɑɪ</span>/	[sound:3001-4000-cambridge-eus70235.mp3]	opposed to or against
vitória	/<span class="ipa dipa">ˈvɪk·tər·i</span>/	[sound:3001-4000-cambridge-victory.mp3]	an act of winning a fight or competition
perspectiva	/<span class="ipa dipa">pərˈspek·tɪv</span>/	[sound:3001-4000-cambridge-perspective.mp3]	the way you think about something
desenhista,projetista,estilista,jeans,óculos de sol,etc. de grife	/<span class="ipa dipa">dɪˈzɑɪ·nər</span>/	[sound:3001-4000-cambridge-designer.mp3]	someone who draws and plans how something will be made
escalar,subir,trepar,entrar em/sair de um lugar apertado,escalada	/<span class="ipa dipa">klɑɪm</span>/	[sound:3001-4000-cambridge-climb.mp3]	to go up something
			
título,nome,forma de tratamento	/<span class="ipa dipa">ˈtɑɪ·t̬<span class="sp dsp">ə</span>l</span>/	[sound:3001-4000-cambridge-title.mp3]	the name of a book, movie, etc.
			
pena,punição,castigo	/<span class="ipa dipa">ˈpʌn·ɪʃ·mənt</span>/	[sound:3001-4000-cambridge-punishment.mp3]	the act of punishing someone
			
			
			
			
			
alusão indireta,insinuação,dica,palpite,insinuar,aludir	/<span class="ipa dipa">hɪnt</span>/	[sound:3001-4000-cambridge-hint.mp3]	something you say that suggests what you think or want, but not in a direct way
móveis,mobília	/<span class="ipa dipa">ˈfɜr·nɪ·tʃər</span>/	[sound:3001-4000-cambridge-furniture.mp3]	things such as chairs, tables, and beds that you put into a room or building
cobertor,camada grossa	/<span class="ipa dipa">ˈblæŋ·kɪt</span>/	[sound:3001-4000-cambridge-blanket.mp3]	a thick, warm cover that you sleep under
enrolar,enroscar,torcer,retorcer,serpentear,virada,mudança,torção,giro,torcedura,dobra,curva	/<span class="ipa dipa">twɪst</span>/	[sound:3001-4000-cambridge-twist.mp3]	to turn something around
gatilho	/<span class="ipa dipa">ˈtrɪɡ·ər</span>/	[sound:3001-4000-cambridge-trigger.mp3]	the part of a gun that you pull when you shoot
			
superfície,face,aparência	/<span class="ipa dipa">ˈsɜr·fəs</span>/	[sound:3001-4000-cambridge-surface.mp3]	the top or outside part of something
continuar,ir em frente,pôr-se a fazer algo	/<span class="ipa dipa">prəˈsid</span>/	[sound:3001-4000-cambridge-eus73722.mp3]	to continue as planned
lábio	/<span class="ipa dipa">lɪp</span>/	[sound:3001-4000-cambridge-lip.mp3]	one of the two soft, red edges of the mouth
suéter,camiseta,jérsei	/<span class="ipa dipa">ˈdʒɝː-</span>/	[sound:3001-4000-cambridge-jersey.mp3]	a piece of wool or cotton clothing that is worn on the upper part of the body and has sleeves but no opening at the front
batatas fritas	/<span class="ipa dipa">frɑɪz</span>/	[sound:3001-4000-cambridge-eus71926.mp3]	long, thin pieces of potato that have been cooked in hot oil
			
			
sobrinha	/<span class="ipa dipa">nis</span>/	[sound:3001-4000-cambridge-niece.mp3]	the daughter of your brother or sister
prático,útil,à mão	/<span class="ipa dipa">ˈhæn·di</span>/	[sound:3001-4000-cambridge-handy.mp3]	useful or easy to use
			
sabonete,sabão,novela de televisão	/<span class="ipa dipa">soʊp</span>/	[sound:3001-4000-cambridge-soap.mp3]	a substance that you use for washing
assinatura	/<span class="ipa dipa">ˈsɪɡ·nə·tʃər</span>/	[sound:3001-4000-cambridge-signature.mp3]	your name written in your own way, which is difficult for someone else to copy
decepcionar	/<span class="ipa dipa">ˌdɪs·əˈpɔɪnt</span>/	[sound:3001-4000-cambridge-disappoint.mp3]	to make someone feel sad because someone or something is not as good as they expected
rastejar,arrastar-se,engatinhar,passo de tartaruga,crawl (estilo de natação)	/<span class="ipa dipa">krɔl</span>/	[sound:3001-4000-cambridge-crawl.mp3]	to move on your hands and knees
			
zoológico	/<span class="ipa dipa">zu</span>/	[sound:3001-4000-cambridge-zoo.mp3]	a place where wild animals are kept and people come to look at them
resultado,consequência,conclusão	/<span class="ipa dipa">rɪˈzʌlt</span>/	[sound:3001-4000-cambridge-result.mp3]	something that happens or exists because something else has happened
			
passado e particípio passado de “light”	/<span class="ipa dipa">lɪt</span>/	[sound:3001-4000-cambridge-lit.mp3]	past tense and past participle of light
virar,capotar,jogar,ligar/desligar		[sound:3001-4000-cambridge-flip.mp3]	If you flip something, you turn it over quickly one or more times, and if something flips, it turns over quickly.
advogado,-a	/<span class="ipa dipa">ˈkɑʊn·səl</span>/	[sound:3001-4000-cambridge-council.mp3]	a lawyer who speaks for someone in court
saúde!,tchau!,obrigado!	/<span class="ipa dipa">tʃɪərz</span>/	[sound:3001-4000-cambridge-cus00373.mp3]	something friendly that you say before you start to drink alcohol with someone
			
			
acusador		[sound:3001-4000-cambridge-usaccre007.mp3]	suggesting that you think someone has done something bad
			
			
			
fase	/<span class="ipa dipa">feɪz</span>/	[sound:3001-4000-cambridge-faze.mp3]	a stage or period that is part of a longer period
estojo,jogo,equipamento	/<span class="ipa dipa">kɪt</span>/	[sound:3001-4000-cambridge-kit.mp3]	things that you keep in a container ready for a particular use
hall,entrada	/<span class="ipa dipa">ˈhɑːl-</span>/	[sound:3001-4000-cambridge-hallway_hall.mp3]	a  hall 
na metade,no meio	/<span class="ipa dipa">ˌhæfˈweɪ</span>/	[sound:3001-4000-cambridge-halfway.mp3]	in the middle between two places, or in the middle of a period of time
preocupado,incomodado,não me incomoda	/<span class="ipa dipa">ˈbɑː.ðɚd</span>/	[sound:3001-4000-cambridge-usbotch003.mp3]	If you are bothered about something, it is important to you and you are worried about it.
útil,utilmente,utilidade	/<span class="ipa dipa">ˈjus·fəl</span>/	[sound:3001-4000-cambridge-useful.mp3]	helping you to do or get something
			
pipoca	/<span class="ipa dipa">ˈpɑpˌkɔrn</span>/	[sound:3001-4000-cambridge-popcorn.mp3]	seeds of maize that break open, get bigger, and turn white when you cook them
			
senhora,cara senhora	/<span class="ipa dipa">ˈmæd·əm</span>/	[sound:3001-4000-cambridge-madam.mp3]	used to be polite when you speak to a woman who you do not know
			
			
reunir-se,juntar-se,juntar,reunir,deduzir	/<span class="ipa dipa">ˈɡæð·ər</span>/	[sound:3001-4000-cambridge-gather.mp3]	to join other people somewhere to make a group
vaqueiro,caubói	/<span class="ipa dipa">ˈkɑʊˌbɔɪ</span>/	[sound:3001-4000-cambridge-cowboy.mp3]	a man whose job is to look after cows in the US, and who rides a horse
			
			
			
chantagem,chantagear	/<span class="ipa dipa">ˈblækˌmeɪl</span>/	[sound:3001-4000-cambridge-blackmail.mp3]	a situation in which someone forces you to do something, or to pay them money, by saying that they will tell another person something secret
			
			
corda,pular corda	/<span class="ipa dipa">roʊp</span>/	[sound:3001-4000-cambridge-rope.mp3]	very thick, strong string
			
comum,ordinário,fora do comum	/<span class="ipa dipa">ˈɔr·d<span class="sp dsp">ə</span>nˌer·i</span>/	[sound:3001-4000-cambridge-eus75283.mp3]	not special or different in any way
			
conceito	/<span class="ipa dipa">ˈkɑn·sept</span>/	[sound:3001-4000-cambridge-concept.mp3]	an idea or principle
cigarro	/<span class="ipa dipa">ˌsɪɡ·əˈret</span>/	[sound:3001-4000-cambridge-cigarette.mp3]	a thin tube of paper filled with tobacco, which people smoke
farpa	/<span class="ipa dipa">bɑːrb</span>/	[sound:3001-4000-cambridge-barb.mp3]	the sharp part that points backwards from a fish hook (= curved piece of wire) or arrow, making it hard to remove it from something
favorável,solidário	/<span class="ipa dipa">-ˈpɔːr.t̬ɪv</span>/	[sound:3001-4000-cambridge-supportive.mp3]	showing agreement and giving encouragement
memorial,comemorativo	/<span class="ipa dipa">-ˈmɔːr.i-</span>/	[sound:3001-4000-cambridge-memorial.mp3]	an object, often large and made of stone, that has been built to honour a famous person or event
			
explosão	/<span class="ipa dipa">ɪkˈsploʊ·ʒən</span>/	[sound:3001-4000-cambridge-explosion.mp3]	the action of something such as a bomb exploding
			
			
			
adular,cortejar		[sound:3001-4000-cambridge-woo.mp3]	to try to persuade someone to support you or to use your business
trauma	/<span class="ipa dipa">ˈtrɑː-</span>/	[sound:3001-4000-cambridge-trauma.mp3]	(a) severe emotional shock and pain caused by an extremely upsetting experience
			
ai!	/<span class="ipa dipa">ɑʊtʃ</span>/	[sound:3001-4000-cambridge-eus75325.mp3]	something you say when you have a sudden pain
			
furioso,furiosamente	/<span class="ipa dipa">ˈfjʊər·i·əs</span>/	[sound:3001-4000-cambridge-furious.mp3]	very angry
enganar,trapacear,surrupiar,trapaceiro,-a	/<span class="ipa dipa">tʃit</span>/	[sound:3001-4000-cambridge-cheat.mp3]	to do something that is not honest, in order to get something
			
			
grosso,de espessura,de grossura,espesso,cerrado,burro,idiota,estúpido	/<span class="ipa dipa">θɪk</span>/	[sound:3001-4000-cambridge-thick.mp3]	Something that is thick is larger than usual between its opposite sides.
			
			
aprovar,aceitar,conformar-se	/<span class="ipa dipa">əˈpruv</span>/	[sound:3001-4000-cambridge-approve.mp3]	to allow something
urgente,urgentemente,com urgência	/<span class="ipa dipa">ˈɜr·dʒənt</span>/	[sound:3001-4000-cambridge-urgent.mp3]	very important and needing you to take action immediately
			
equívoco,mal-entendido	/<span class="ipa dipa">mɪsˌʌn·dərˈstæn·dɪŋ</span>/	[sound:3001-4000-cambridge-misunderstanding.mp3]	a situation in which someone does not understand something correctly
